<?xml version="1.0" encoding="UTF-8" standalone="no" ?>
<!DOCTYPE pedido SYSTEM "pedido.dtd">
<pedido>
<fecha>2012/02/20</fecha>
<cuerpo_pedido>
  <articulo id="872-AA">
    <nombre>Cortadora de cesped</nombre>
    <tipo>electrica</tipo>
    <unidades>1</unidades>
    <precio>148.95</precio>
  </articulo>
  <articulo id="926-FH">
    <nombre>Podadora de setos</nombre>
    <tipo>?</tipo>
    <unidades>3</unidades>
    <precio>7.98</precio>
  </articulo>
</cuerpo_pedido>
<cliente>
  <nombre>Ricardo Movilla</nombre>
  <direccion_entrega>
    <nombre>In√©s Abad</nombre>
    <calle>Plaza de la Duquesa</calle>
    <numero>12</numero>
    <cp>31010</cp>
    <localidad>Pamplona</localidad>
    <provincia>Nafarroa</provincia>
  </direccion_entrega>
  <direccion_facturacion>
    <calle>Avenida de Gasteiz</calle>
    <numero>56</numero>
    <localidad>Vitoria-Gasteiz</localidad>
    <provincia>Araba</provincia>
    <cp>01012</cp>
  </direccion_facturacion>
</cliente>
</pedido>
